{
  "catalogVersion": "2.0.0",
  "generatedAt": "2026-09-01",
  "invocation": {
    "command": "cli.invoke --cli <CLI> --action <ACTION> -- <ACTION_OPTIONS>",
    "resultEnvelope": {
      "success": {
        "ok": true,
        "data": {}
      },
      "failure": {
        "ok": false,
        "error": {}
      }
    }
  },
  "guide": {
    "glossary": [
      {
        "term": "Capability domain",
        "meaning": "NAS ，File management、Albummonitoring。"
      },
      {
        "term": "CLI capability",
        "meaning": "， ug-filesystem； CLI。"
      },
      {
        "term": "Action",
        "meaning": "CLI operation， find Findfile。"
      },
      {
        "term": "Effect",
        "meaning": "operationReaddata，、、Createdata。"
      },
      {
        "term": "Approval",
        "meaning": "operation，Requiresuserconfirmation。"
      }
    ],
    "domains": [
      {
        "domain": "file",
        "typicalRequests": [
          "file、directory",
          "OrganizeDownloaddirectory",
          "file、tag、file"
        ],
        "boundaries": [
          "、operationRequiresApproval",
          "Findscope，file"
        ]
      },
      {
        "domain": "album",
        "typicalRequests": [
          "people、location、timephotos",
          "CreateAlbum",
          "Organizephotostime"
        ],
        "boundaries": [
          "CreateAlbumconfirmationrealphotos",
          "Cannotphotos ID、Album ID filepath"
        ]
      },
      {
        "domain": "monitor",
        "typicalRequests": [
          "Querymonitoringevents",
          "confirmationvehicles",
          "Organizeeventsevidence"
        ],
        "boundaries": [
          "realeventsidentityresult",
          "、Approval"
        ]
      },
      {
        "domain": "media",
        "typicalRequests": [
          "English typicalRequests text.",
          "Play",
          "SearchDownloadSubtitles"
        ],
        "boundaries": [
          "SubtitlesDownloadMustrealSubtitlesresult",
          "Nocontentresult"
        ]
      },
      {
        "domain": "music",
        "typicalRequests": [
          "、、Music",
          "Play、、"
        ],
        "boundaries": [
          "Playresultuser",
          "SearchresultMusic"
        ]
      },
      {
        "domain": "document",
        "typicalRequests": [
          "ReadExtractDocumentscontent",
          "Documents、Translate、"
        ],
        "boundaries": [
          "RequiresrealDocuments，content",
          "CannotReadDocumentscontent"
        ]
      },
      {
        "domain": "knowledge",
        "typicalRequests": [
          "QueryKnowledge",
          "English typicalRequests text.",
          "textSave"
        ],
        "boundaries": [
          "Mustrealresult",
          "Savecontent"
        ]
      }
    ],
    "scenarios": [
      {
        "name": "Downloaddirectory",
        "userRequest": "Downloaddirectoryfile，confirmationfileOrganizedirectory。",
        "steps": [
          {
            "cli": "ug-filesystem",
            "action": "ls",
            "purpose": "ReadDownloaddirectoryrealfile"
          },
          {
            "cli": "ug-filemgr",
            "action": "scan-dedupe",
            "purpose": "file"
          },
          {
            "cli": "file-workflow",
            "action": "batch-move",
            "purpose": "userconfirmationfile"
          }
        ],
        "boundary": "result；Mustconfirmation，Cannotfile。"
      },
      {
        "name": "photosAlbum",
        "userRequest": "photos，Album",
        "steps": [
          {
            "cli": "ug-photo",
            "action": "search-picture",
            "purpose": "time、location、peopleFindphotos"
          },
          {
            "cli": "ug-photo",
            "action": "create-album",
            "purpose": "userconfirmationrealphotosCreateAlbum"
          }
        ],
        "boundary": "SearchCreate；Do notphotosphotosAlbum。"
      },
      {
        "name": "anomaly",
        "userRequest": "Noanomaly？？evidenceOrganize",
        "steps": [
          {
            "cli": "ug-surveillance",
            "action": "event-timeline",
            "purpose": "Queryrealmonitoringevents"
          },
          {
            "cli": "ug-surveillance",
            "action": "identity-resolve",
            "purpose": "eventspeoplevehiclesidentity"
          },
          {
            "cli": "ug-surveillance",
            "action": "event-evidence",
            "purpose": "eventsevidence"
          }
        ],
        "boundary": "identityMustunknown；Do notevents。"
      },
      {
        "name": "Subtitles",
        "userRequest": "，NoSubtitles。",
        "steps": [
          {
            "cli": "ug-video",
            "action": "search",
            "purpose": "timerealMediaresult"
          },
          {
            "cli": "ug-video",
            "action": "subtitle-search",
            "purpose": "userSearchSubtitles"
          }
        ],
        "boundary": "RequiresDownloadSubtitles，realSubtitles file-id  subtitle-download；CannotSearch ID。"
      },
      {
        "name": "SearchMusic",
        "userRequest": "Play， 30%。",
        "steps": [
          {
            "cli": "ug-music",
            "action": "search",
            "purpose": "SearchPlayMusic"
          },
          {
            "cli": "ug-music",
            "action": "control",
            "purpose": "Playuser"
          }
        ],
        "boundary": "SearchPlay；resultPlayreal。"
      },
      {
        "name": "contractinvoice",
        "userRequest": "contractinvoice，projecttagOrganizedirectory。",
        "steps": [
          {
            "cli": "ug-filesystem",
            "action": "find",
            "purpose": "Findfilefile"
          },
          {
            "cli": "ug-document",
            "action": "extract",
            "purpose": "realDocumentsExtractproject"
          },
          {
            "cli": "ug-filemgr",
            "action": "tag-add-file",
            "purpose": "userconfirmationfileprojecttag"
          },
          {
            "cli": "ug-filesystem",
            "action": "mkdir",
            "purpose": "Createdirectory"
          },
          {
            "cli": "ug-filesystem",
            "action": "cpmv",
            "purpose": "confirmationfiledirectory"
          }
        ],
        "boundary": "DocumentscontentExtractfailureproject；Mustconfirmationscope。"
      },
      {
        "name": "meeting",
        "userRequest": "meetingtext，Savemeeting。",
        "steps": [
          {
            "cli": "ug-knowledge",
            "action": "audio-transcription",
            "purpose": "realtext"
          },
          {
            "cli": "ug-knowledge",
            "action": "save-text",
            "purpose": "userconfirmationcontentSave"
          }
        ],
        "boundary": "failurecontent，Do notcontent；Saveconfirmation。"
      }
    ]
  },
  "domains": [
    {
      "id": "music",
      "name": "Music",
      "description": "MusicPlay。"
    },
    {
      "id": "media",
      "name": "Media",
      "description": "Mediacontent、PlaySubtitles。"
    },
    {
      "id": "monitor",
      "name": "Monitoring center",
      "description": "Query、monitoringevents、identityevidence。"
    },
    {
      "id": "file",
      "name": "File management",
      "description": "、、fileOrganize。"
    },
    {
      "id": "document",
      "name": "Documents",
      "description": "Read、、、TranslateDocuments。"
    },
    {
      "id": "knowledge",
      "name": "Knowledge",
      "description": "Knowledge、、audioSave。"
    },
    {
      "id": "album",
      "name": "Album",
      "description": "photosAlbumAlbumOrganize。"
    }
  ],
  "clis": [
    {
      "name": "ug-music",
      "domain": "music",
      "description": "MusicMusicPlay。",
      "agent": "media-agent",
      "actions": [
        {
          "name": "search",
          "description": "ug-music  search operation。",
          "parameters": [
            {
              "name": "type",
              "type": "string",
              "required": true,
              "repeatable": false,
              "description": "`type*`=`query|song|singer|album|genre|year|songlist|library|collection|recent|random`",
              "enum": [
                "query",
                "song",
                "singer",
                "album",
                "genre",
                "year",
                "songlist",
                "library",
                "collection",
                "recent",
                "random"
              ]
            },
            {
              "name": "keyword",
              "type": "string",
              "required": false,
              "repeatable": false,
              "description": "`keyword` string"
            },
            {
              "name": "play",
              "type": "boolean",
              "required": false,
              "repeatable": false,
              "description": "`play` boolean"
            },
            {
              "name": "singer-name",
              "type": "string",
              "required": false,
              "repeatable": false,
              "description": "`singer-name` string"
            },
            {
              "name": "album-name",
              "type": "string",
              "required": false,
              "repeatable": false,
              "description": "`album-name` string"
            },
            {
              "name": "songlist-id",
              "type": "integer",
              "required": false,
              "repeatable": false,
              "description": "`songlist-id` integer>=1",
              "minimum": 1
            },
            {
              "name": "start-year",
              "type": "integer",
              "required": false,
              "repeatable": false,
              "description": "`start-year`/`end-year` integer>=0",
              "minimum": 0
            },
            {